,_id,ltable_id,rtable_id,ltable_title,ltable_authors,ltable_year,rtable_title,rtable_authors,rtable_year,label
8829,8829,journals/vldb/AbadiCCCCLSTZ03,url:http://portal.acm.org/ft_gateway.cfm%3Fid%3D1024702%26type%3Dpdf,aurora: a new model and architecture for data stream management,"d abadi, d carney, u ï¿½etintemel, m cherniack, c convey, s lee, m stonebraker, n tatbul, s zdonik",2003,"the genalg project: developing a new integrating data model, language, and tool for managing and  ","j hammer, m schneider",2004,0
1004,1004,conf/sigmod/FegarasM95,LSWVPfB8TC4J,towards an effective calculus for object query languages,"l fegaras, d maier",1995,towards an effective calculus for object query languages,"l fegaras, d maier",1995,1
2766,2766,conf/sigmod/ZhaoDNS98,MjGo7AhsPSsJ,simultaneous optimization and evaluation of multiple dimensional queries,"y zhao, p deshpande, j naughton, a shukla",1998,simultaneous optimization and evaluation ofmultiple dimensional queries,"y zhao, p deshpande, j naughton, a shukla",0,1
680,680,conf/sigmod/ChaudhuriD97,4zZ7Lxt4PPIJ,data warehousing and olap for decision support (tutorial),,1997,data warehousing and olap for decision support (tutorial),"s chaudhuri, u dayal",0,1
450,450,conf/sigmod/BohrerBBCFHKKMNRRSUUW97,7OyvdUHeptMJ,infosleuth: semantic integration of information in open and dynamic environments (experience paper),"r jr., w bohrer, r brice, a cichocki, j fowler, a helal, v kashyap, t ksiezyk, g martin, m nodine, m rashid, m rusinkiewicz, r shea, c unnikrishnan, a unruh, d woelk",1997,"dynamic service matchmaking among agents in open information environments, semantic interoperability ","k sycara, m klusch, j lu, s wido",0,0
4713,4713,conf/vldb/PapadiasT01,faqaX7J_Kl8J,mv3r-tree: a spatio-temporal access method for timestamp and interval queries,"y tao, d papadias",2001,spatial queries in dynamic environments,"y tao, d papadias",2003,0
2455,2455,conf/sigmod/SrikantA96,WSVs3nCRe8EJ,mining quantitative association rules in large relational tables,"r srikant, r agrawal",1996,"mining quantitative association rules in large relational tables, to appear in proc","r srikant, r agrawal",0,1
7638,7638,journals/sigmod/Roussopoulos98,qrfeEEm1pcQJ,materialized views and data warehouses,n roussopoulos,1998,an incremental access method for viewcache: concept,n roussopoulos,0,0
8100,8100,journals/sigmod/Widom95a,url:http://www.roc.noaa.gov/news/vol1is4.pdf,editor's notes,j widom,1995,editor's notes,nl smith,1981,0
6923,6923,journals/sigmod/Kim99,RETGb_jFnQIJ,"message from editor-in-chief, acm transactions on database systems",w kim,1999,on optimizing an sql-like nested query,w kim,1982,0
556,556,conf/sigmod/BunemanDHS96,AtUsoMh8rY4J,a query language and optimization techniques for unstructured data,"p buneman, s davidson, g hillebrand, d suciu",1996,a query language and optimization techniques for unstructured dataâ» in sigmod,"p buneman, s davidson, g hillebrand, d suciu",0,1
7538,7538,journals/sigmod/RiekertMW97,C-yzbvoAg00J,management of data and services in the environmental information system (uis) of baden-wï¿½rttemberg,"w riekert, r mayer-fï¿½ll, g wiest",1997,tutorial: state of the art in workflow management system research and products,c mohan,1996,0
476,476,conf/sigmod/BouguettayaBH99,--PsNHvlpbIJ,"world wide database - integrating the web, corba, and databases","a bouguettaya, b benatallah, l hendra, j beard, k smith, m ouzzani",1999,carnot and infosleuth: database technology and the world wide web,d woelk,1995,0
4077,4077,conf/vldb/JagadishLRSS94,Yiwh22hbTAcJ,dalï¿½: a high performance main memory storage manager,"h jagadish, d lieuwen, r rastogi, a silberschatz, s sudarshan",1994,dali: a high performance main memory storage manager,"hv jagadish, d lieuwen, r rastogi",1994,1
1113,1113,conf/sigmod/GarofalakisGR02,ImADir74KWIJ,querying and mining data streams: you only get one look a tutorial,,2002,"query and mining data streams: you only get one look, in â??vldbâ??02","m garofalakis, j gehrke, r rastogi",0,1
6051,6051,journals/sigmod/CiliaB02,Y1HVgTopekIJ,an active functionality service for e-business applications,"m cilia, a buchmann",2002,an active functionality service for e-business applications,"m cilia, ap buchmann",2002,1
3876,3876,conf/vldb/GravanoG95,zbJYyUhl2cIJ,generalizing gloss to vector-space databases and broker hierarchies,"l gravano, h garcia-molina",1995,"generalizing gloss to vector-space databases and broker hierarchies. technicalreport,  ","l gravano, h garcia-molina",1995,1
6986,6986,journals/sigmod/LabrinidisR00,3Ozte0ucNJAJ,generating dynamic content at database-backed web servers: cgi-bin vs. mod_perl,"a labrinidis, n roussopoulos",2000,update propagation strategies for improving the quality of data on the web,"a labrinidis, n roussopoulos",2001,0
9034,9034,journals/vldb/C94c,-7PP3rSp1UcJ,"title, foreword, preface to the special issue on spatial database systems, index vol. 3",,1994,an introduction to spatial database systems. special issue on spatial database systems of the vldb  ,rh guting,1994,0
4536,4536,conf/vldb/Mohan02a,IGS3TtqfKUgJ,an efficient method for performing record deletions and updates using index scans,c mohan,2002,application servers: born-again tp monitors for the web?,c mohan,2001,0
1009,1009,conf/sigmod/FegarasSRM00,4_4Jg_EQ8EkJ,lambda-db: an odmg-based object-oriented dbms,"l fegaras, c srinivasan, a rajendran, d maier",2000,&amp;lgr;-db: an odmg-based object-oriented dbms,"l fegaras, c srinivasan, a rajendran, d maier",0,1
102,102,conf/sigmod/AbiteboulCM95,XTa-ElbpjZ8J,a database interface for file updates,"s abiteboul, s cluet, t milo",1995,a logical view of structured les,"s abiteboul, s cluet, t milo",0,0
1420,1420,conf/sigmod/Hidber99,HkBKH9ZUJEcJ,online association rule mining,c hidber,1999,"online association rule mining, sigmod 1999",c hidber,0,1
3208,3208,conf/vldb/BohannonLRSSS97,Vj1kbPjzSHwJ,logical and physical versioning in main memory databases,"r rastogi, s seshadri, p bohannon, d leinbaugh, a silberschatz, s sudarshan",1997,logical and physical versioning in main memory databases,"p bohannon, d leinbaugh, r rastogi, s seshadri, a  ",1997,1
1138,1138,conf/sigmod/GeorgeH97,M0W5X_JA5kcJ,secure transaction processing in firm real-time database systems,"b george, j haritsa",1997,secure buffering inâ® rm real-time database systems,"b george, j haritsa",0,0
436,436,conf/sigmod/BlakeleyP98,yotsUgKBK44J,microsoft universal data access platform,"j blakeley, m pizzo",1998,microsoft universal data access platform,"ja blakeley, mj pizzo",0,1
2267,2267,conf/sigmod/RodriguezR00,gi7N9eQiTx4J,mocha: a self-extensible database middleware system for distributed data sources,"m rodriguez-martinez, n roussopoulos",2000,mocha: a self-extensible middleware system for distributed data sources,"m rodrä±guez-martä±nez, n roussopoulos",0,1
4993,4993,conf/vldb/SavasereON95,hLrdara3zskJ,an efficient algorithm for mining association rules in large databases,"a savasere, e omiecinski, s navathe",1995,an effective hash-based algorithm for mining association rules,"js park, ps yu",0,0
2292,2292,conf/sigmod/RoySSB00,OV6n7LhOe_cJ,efficient and extensible algorithms for multi query optimization,"p roy, s seshadri, s sudarshan, s bhobe",2000,efficient and extensible algorithms for multi query optimization,"d quass, a gupta, i mumick, j widom",0,1
5468,5468,conf/vldb/WuYCT95,7C1w4dd8VyUJ,a performance study of workfile disk management for concurrent mergesorts in a multiprocessor database system,"k wu, p yu, j chung, j teng",1995,effects of locking granularity in a database management system,"dr ries, m stonebraker",1977,0
3422,3422,conf/vldb/ChaudhuriS94,bd-Lu1jeg-AJ,including group-by in query optimization,"s chaudhuri, k shim",1994,including group-by in query optimization,"s chaudhari, k shim",1994,1
9061,9061,journals/vldb/ChanFGR02,ZFI7XBuonJAJ,efficient filtering of xml documents with xpath expressions,"c chan, p felber, m garofalakis, r rastogi",2002,tree pattern aggregation for scalable xml data dissemination,"cy chan, w fan, p felber, mn garofalakis, r  ",2002,0
8012,8012,journals/sigmod/VassiliadisS99,eGARASwVBrUJ,a survey of logical models for olap databases,"p vassiliadis, t sellis",1999,a survey of logical models for olap databases,"p vassiliadis, tk sellis",1999,1
7421,7421,journals/sigmod/PourabbasR00,QyNfyYDySawJ,hierarchies and relative operators in the olap environment,"e pourabbas, m rafanelli",2000,a pictorial query language for querying geographic databases using positional and olap operators,"e pourabbas, m rafanelli",2002,0
3063,3063,conf/vldb/BalminPP00,FoAVdcYe0tsJ,hypothetical queries in an olap environment,"a balmin, t papadimitriou, y papakonstantinou",2000,hypothetical queries in an olap environment,"a balmin, t papadimitriou, y papakonstantinou",2000,1
8512,8512,journals/tods/FukudaMMT01,ZGYtJqgVD2cJ,data mining with optimized two-dimensional association rules,"t fukuda, y morimoto, s morishita, t tokuyama",2001,theory of communication,"t fukuda, y morimoto, s morishita, t tokuyama",0,0
7640,7640,journals/sigmod/Roussopoulos98,url:http://portal.acm.org/citation.cfm%3Fid%3D16857,materialized views and data warehouses,n roussopoulos,1998,engineering information systems (panel session): builders and designers perspective,n roussopoulos,1986,0
3378,3378,conf/vldb/ChandrasekaranF02,nqosSM46lCkJ,streaming queries over streaming data,"s chandrasekaran, m franklin",2002,streaming queries over streaming data,"s chandrasekaran, mj franklin",2002,1
3458,3458,conf/vldb/CherniackFZ01,49EWG8vzsXUJ,data management for pervasive computing,"m cherniack, m franklin, s zdonik",2001,data management for pervasive computing,"m cherniack, mj franklin, sb zdonik",2001,1
122,122,conf/sigmod/AcharyaFZ97,QCAu6wPhnAAJ,balancing push and pull for data broadcast,"s acharya, m franklin, s zdonik",1997,balancing push and pull for data broadcast,"a swarup, m franklin, s zdonik",0,1
1674,1674,conf/sigmod/LabrinidisR00,rKbwxobcJZYJ,webview materialization,"a labrinidis, n roussopoulos",2000,exploring the tradeoff between performance and data freshness in database-driven web servers,"a labrinidis, n roussopoulos",2004,0
3826,3826,conf/vldb/GoldmanW97,_lvdMphdfvEJ,dataguides: enabling query formulation and optimization in semistructured databases,"r goldman, j widom",1997,dataguides enabling query formulationandoptimizationinsemistructureddatabases,"r goldman, j widom",0,1
3216,3216,conf/vldb/BonczMK99,bPCHuDzkKY4J,database architecture optimized for the new bottleneck: memory access,"p boncz, s manegold, m kersten",1999,optimizing database architecture for the new bottleneck: memory access (extended paper published for ,"p boncz, s manegold, m kersten",0,0
1904,1904,conf/sigmod/Mohan01,XppwYYxOpksJ,application servers: born-again tp monitors for the web? (panel abstract),c mohan,2001,a database perspective on lotus domino/notes,c mohan,1999,0
9122,9122,journals/vldb/EvangelidisS97,-953Ij-RwjcJ,"the hb-pi-tree: a multi-attribute index supporting concurrency, recovery and node consolidation","g evangelidis, d lomet, b salzberg",1997,the hb (pi)-tree: a concurrent and recoverable multi-attribute access method,"g evangelidis, d lomet, b salzberg",0,0
3346,3346,conf/vldb/ChakrabartiDAR97,0EbuWDceVnoJ,"using taxonomy, discriminants, and signatures for navigating in text databases","s chakrabarti, b dom, r agrawal, p raghavan",1997,  classification and signature generation for organizing large text databases into hierarchical topic ,"s chakrabarti, b dom, r agrawal, p raghavan",1998,0
2930,2930,conf/vldb/AgrawalS94,nDgZsMNOofwJ,fast algorithms for mining association rules in large databases,"r agrawal, r srikant",1994,jorge b. bocca and matthias jarke and carlo zaniolo,"r agrawal, r srikant",0,0
2295,2295,conf/sigmod/RundensteinerCCSO00,url:http://portal.acm.org/ft_gateway.cfm%3Fid%3D335496%26type%3Dpdf%26dl%3DGUIDE%26dl%3DACM%26CFID%3D11111111%26CFTOKEN%3D2222222,serfing the web: web site management made easy,"e rundensteiner, k claypool, l chen, h su, k oenoki",2000,serfing the web: web site management made easy,"ea rundensteiner, kt claypool, l chen, h su, k  ",0,1
8687,8687,journals/tods/RaschidL96,F8CXWrRYc-EJ,semantics for update rule programs and implementations in a relational database management system,"l raschid, j lobo",1996,"r a. lorie, and tt price. access path selection ma relational database management system","pg selinger, mm astrahan, dd chamberlain",0,0
1477,1477,conf/sigmod/IvesLPST00,4-FwpSOweRAJ,self-organizing data sharing communities with sagres,"z ives, a levy, j madhavan, r pottinger, s saroiu, i tatarinov, s betzler, q chen, e jaslikowska, j su, w yeung",2000,self-organizing data sharing communities with sagres: system demonstration,"z ives, a levy, j madhavan, r pottinger, s saroiu, ",0,1
1682,1682,conf/sigmod/LakshmananNHP99,DfOLEzMoEaEJ,optimization of constrained frequent set queries with 2-variable constraints,"l lakshmanan, r ng, j han, a pang",1999,optimization of constrained frequent set queries with 2-variable constraints,"lvs lakshmanan, rt ng, j han, a pang",1999,1
8890,8890,journals/vldb/ApersCS02,eW3sswNykJoJ,editorial,,2002,editorial,ca insko,0,0
1197,1197,conf/sigmod/GotoK03,2Pc6rKYB8ykJ,integration of electronic tickets and personal guide system for public transport using mobile terminals,"k goto, y kambayashi",2003,a new passenger support system for public transport using mobile database access,"k goto, y kambayashi",2002,0
2837,2837,conf/vldb/AgarwalADGNRS96,iX8lBZBEgSwJ,on the computation of multidimensional aggregates,"s agarwal, r agrawal, p deshpande, a gupta, j naughton, r ramakrishnan, s sarawagi",1996,"raghu ramakrishnan, sunita sarawagi. on the computation of multidimensional aggregates","s agarwal, r agrawal, pm deshpande, a gupta, jf  ",0,1
6823,6823,journals/sigmod/Ioannidis96,IgQsVaud8BIJ,dynamic information visualization,y ioannidis,1996,dynamic information visualization,y ioannidis,1996,1
6243,6243,journals/sigmod/EisenbergM98,AatoNnELw78J,standards in practice,"a eisenberg, j melton",1998,"sqlj part 0, now known as sql/olb (object-language bindings)","a eisenberg, j melton",1998,0
2989,2989,conf/vldb/AnandBH94,3e2gsMgcVUsJ,an empirical performance study of the ingres search accelerator for a large property management database system,"s anand, d bell, j hughes",1994,performance of a two-headed disk system when serving database queries under the scan policy,"y manolopoulos, jg kollias",1989,0
688,688,conf/sigmod/ChaudhuriDY95,aaQEdfkjWN8J,join queries with external text sources: execution and optimization techniques,"s chaudhuri, u dayal, t yan",1995,join queries with external text sources: execution and optimization techniques,"s chaudhuri, u dayal, tw yan",1995,1
4842,4842,conf/vldb/RothOH99,0conc5JGbvUJ,cost models do matter: providing cost information for diverse data sources in a federated system,"m roth, f ozcan, l haas",1999,spatial search for multicomponent objects in a geographic information system using symbolic models  ,s menon,1990,0
3357,3357,conf/vldb/ChakrabartiGRS00,PTmCbogNUpAJ,approximate query processing using wavelets,"k chakrabarti, m garofalakis, r rastogi, k shim",2000,approximate query processing using wavelets,"k chakrabarti, m garofalakis, r rastogi, k shim",2001,1
1840,1840,conf/sigmod/MamoulisP99,xdAsc3yVWvYJ,integration of spatial join algorithms for processing multiple inputs,"n mamoulis, d papadias",1999,"integration of spatial join algorithm for processing multiple joins,''","n mamoulis, d papadias",0,1
8127,8127,journals/sigmod/Widom96,xgdBJbatYcIJ,editor's notes,j widom,1996,editor's notes,wmk trochim,0,0
5101,5101,conf/vldb/SeshadriLR96,yCSb05U8FHcJ,the design and implementation of a sequence database system,"p seshadri, m livny, r ramakrishnan",1996,"the design, implementation and evaluation of a software-based real-time ethernet protocol","t chiueh, c venkatramani",1995,0
8694,8694,journals/tods/RaschidL96,ng5wXF3RpSwJ,semantics for update rule programs and implementations in a relational database management system,"l raschid, j lobo",1996,access path selection in a relational database management system,"pp griffiths, mm astrahan, dd chamberlin, ra lorie ",0,0
5453,5453,conf/vldb/WeikumMHZ02,uNwtCAfL3T4J,self-tuning database technology and information services: from wishful thinking to viable engineering,"g weikum, a mï¿½nkeberg, c hasse, p zabback",2002,self-tuning e-services: from wishful thinking to viable engineering-position paper-,g weikum,0,1
4178,4178,conf/vldb/KonopnickiS95,url:http://portal.acm.org/ft_gateway.cfm%3Fid%3D1083596%26type%3Dpdf,w3qs: a query system for the world-wide web,"d konopnicki, o shmueli",1995,database-inspired search,"d konopnicki, o shmueli",2005,0
181,181,conf/sigmod/Agarwal96,Ca-BABwlsQAJ,a super scalar sort algorithm for risc processors,r agarwal,1996,a super scalar sort algorithm for risc processors,rc agarwrd,0,1
6768,6768,journals/sigmod/HasselbringHHKRRS00,_MXfp9GHEqQJ,"research and practice in federated information systems, report of the efis '2000 international workshop",,2000,database research: achievements and opportunities into the 21st century. a report of an nsf workshop ,"a siberschatz, m stonebraker, jd ullman",0,0
6705,6705,journals/sigmod/HalkidiBV02,GHjgDrEbqM4J,cluster validity methods: part i,"m halkidi, y batistakis, m vazirgiannis",2002,cluster validity methods: part i,"m halkidi, y batistakis, m vazirgiannis",2002,1
2381,2381,conf/sigmod/ShanmugasundaramNSR99,tOo-2IqYbpkJ,efficient concurrency control for broadcast environments,"j shanmugasundaram, a nithrakashyap, r sivasankaran, k ramamritham",1999,et. ai. efficient concurrency control for broadcast environments univ,sj shanmugasundsram,0,1
2307,2307,conf/sigmod/SagonasSW94,nF5iGEtihWYJ,xsb as an efficient deductive database engine,"k sagonas, t swift, d warren",1994,"xsb as an efficient deductive database engine, 1993","k sagonas, t swift, ds warren",0,1
5301,5301,conf/vldb/Suciu96,Y7kHpHu3nP0J,query decomposition and view maintenance for query languages for unstructured data,d suciu,1996,distributed query evaluation on semistructured data,d suciu,2002,0
332,332,conf/sigmod/AtzeniT97,sl5fFaV_DUQJ,mdm: a multiple-data-model tool for the management of heterogeneous database schemes,"p atzeni, r torlone",1997,a toolkit for the incremental implementation of heterogeneous database management systems,"p drew, r king, d heimbigner",1992,0
725,725,conf/sigmod/ChaudhuriN98a,Y-kXztd20YQJ,microsoft index tuning wizard for sql server 7.0,"s chaudhuri, v narasayya",1998,microsoft index tuning wizard forsql server 7.0,"s chaudhuri, vr narasayya",0,1
1425,1425,conf/sigmod/HinneburgK99,ExJOsE4lD8UJ,clustering methods for large databases: from the past to the future,"a hinneburg, d keim",1999,cluster discovery methods for large data bases-from the past to the future,"a hinneburg, da keim",0,0
3138,3138,conf/vldb/BerchtoldKK96,KLzrIupmRloJ,the x-tree : an index structure for high-dimensional data,"s berchtold, d keim, h kriegel",1996,the x-tree: an index structure for highdimensional data. 22nd conf. on very large databases,"s berchtold, d keim, hp kriegel",0,1
7957,7957,journals/sigmod/Suciu02,_vOvQUzSV-gJ,the xml typechecking problem,d suciu,2002,on database theory and xml,d suciu,2001,0
4517,4517,conf/vldb/Mohan01,p0wBdI_JiXMJ,caching technologies for web applications,c mohan,2001,in: technology for web services,c mohan,0,0
6251,6251,journals/sigmod/EisenbergM98a,-RAYAJbKLNUJ,"sqlj part 0, now known as sql/olb (object-language bindings)","a eisenberg, j melton",1998,standards in practice,"a eisenberg, j melton",1998,0
968,968,conf/sigmod/Epstein95,AgpGguTHfGsJ,keynote address,,1995,keynote address,hbn hynes,0,0
6180,6180,journals/sigmod/DogacAOD95,p6ro8VCQBwcJ,implementation aspects of an object-oriented dbms,"a dogac, m altinel, c ozkan, i durusoy",1995,metu object-oriented dbms kernel,"a dogac, a altinel, c ozkan",1995,0
3597,3597,conf/vldb/DeenJNNW00,jpJMa9UNggoJ,a 20/20 vision of the vldb-2020?,"s deen, a jhingran, s navathe, e neuhold, g wiederhold",2000,a 20/20 vision of the vldb-2020?,sm deen,2000,1
5783,5783,journals/sigmod/AndlerHEMBE96,J82SdCmczAcJ,deeds towards a distributed and active real-time database system,"s andler, j hansson, j eriksson, j mellin, m berndtsson, b eftring",1996,1996 . deeds| towards a distributed active and real-time database system,"sf andler, j hanson, j eriksson, j mellin, m  ",0,1
5612,5612,journals/sigmod/Aberer02,2r6t9GEZb28J,book review column,k aberer,2002,special issue on peer to peer data management,k aberer,0,0
811,811,conf/sigmod/CluetDSS98,lOZF0Ee3rUQJ,your mediators need data conversion!,"s cluet, c delobel, j simï¿½on, k smaga",1998,your mediators need data conversion!,"s cluet, c delobel",0,1
4228,4228,conf/vldb/LabioG96,1JLlGYW8cDAJ,efficient snapshot differential algorithms for data warehousing,"w labio, h garcia-molina",1996,h. garcia-m olina. efficient snapshot differential algorithms in data warehousing,w labio,0,1
6063,6063,journals/sigmod/ConradHHKRSS99,nmEhI0tiWGAJ,engineering federated information systems: report of efis '99 workshop,"s conrad, w hasselbring, u hohenstein, r kutsche, m roantree, g saake, f saltor",1999,engineering federated information systems: report of efis '99 workshop,"s conrad, w hasselbring, u hohenstein, rd kutsche, ",1999,1
7844,7844,journals/sigmod/Snodgrass03b,VwZQmafqkE0J,journal relevance,r snodgrass,2003,the temporal query language tquel,r snodgrass,1987,0
8057,8057,journals/sigmod/Widom95,TUOBVMb4PBsJ,editor's notes,j widom,1995,editor's notes,dw leslie,0,0
3738,3738,conf/vldb/GarciaLL98,eJrqu6I2pHkJ,on optimal node splitting for r-trees,"y garcï¿½a, m lopez, s leutenegger",1998,on optimal node splitting for r-trees,"yj garcä±a, ma lopez, st leutenegger",0,1
5358,5358,conf/vldb/TorloneA03,v6kudD3ItEoJ,chameleon: an extensible and customizable tool for web data translation,"r torlone, p atzeni",2003,chameleon: an extensible and customizable tool for web data translation,"r torlone, p atzeni",2003,1
9420,9420,journals/vldb/PucheralBVB01,K9Qbh3haBCMJ,picodbms: scaling down database techniques for the smartcard,"p pucheral, l bouganim, p valduriez, c bobineau",2001,picodbms: scaling down database techniques for the smartcard (best paper award),"c bobineau, l bouganim, p pucheral, p valduriez",0,1
3950,3950,conf/vldb/HanF95,GeMycbLXZUkJ,discovery of multiple-level association rules from large databases,"j han, y fu",1995,fuy (1995) discovery of multiple-level association rules from large databases,j han,0,1
2024,2024,conf/sigmod/MumickP94,pj1mKocpW9QJ,implementation of magic-sets in a relational database system,"i mumick, h pirahesh",1994,implementation of a time expert in a database system,"r overmyer, m stonebraker",1982,0
1484,1484,conf/sigmod/JaedickeM98,zh6yaOX2xiQJ,on parallel processing of aggregate and scalar functions in object-relational dbms,"m jaedicke, b mitschang",1998,user-defined table operators: enhancing extensibility for ordbms,"m jaedicke, b mitschang",1999,0
1455,1455,conf/sigmod/HungYK96,P6VVKZUo4pgJ,capbased-ams: a capability-based and event-driven activity management system,"p hung, h yeung, k karlapalem",1996,capbased-ams: a capability-based and event-driven activity management system (demonstrations),"pck hung, hp yeung, k karlapalem",0,1
2280,2280,conf/sigmod/Ross00,Qy9P0M6WLmcJ,expressing business rules,r ross,2000,atherosclerosis: current understanding of mechanisms and future strategies in therapy,r ross,1993,0
1690,1690,conf/sigmod/LakshmananPZ03,tcnjvKELfs0J,qc-trees: an efficient summary structure for semantic olap,"l lakshmanan, j pei, y zhao",2003,efficacious data cube exploration by semantic summarization and compression (demo paper) in,"l lakshmanan, j pei, y zhao",0,0
6375,6375,journals/sigmod/Franklin00,url:http://doi.wiley.com/10.1002/ev.1658,editor's notes,m franklin,2000,editor's notes,l sechrest,1993,0
7596,7596,journals/sigmod/RossCGJBV99,url:http://portal.acm.org/ft_gateway.cfm%3Fid%3D390004%26type%3Dpdf%26dl%3DGUIDE%26dl%3DACM%26CFID%3D11111111%26CFTOKEN%3D2222222,reminiscences on influential papers,,1999,reminiscences on influential papers,e bertino,1976,0
3344,3344,conf/vldb/ChakrabartiBD99,zmBMRUNv8sQJ,distributed hypertext resource discovery through examples,"s chakrabarti, m berg, b dom",1999,distributed hypertext resource discovery through examples,"s chakrabarti, m van den berg, b dom",1999,1
6883,6883,journals/sigmod/KappelR98,LnNHfHLFsEcJ,the trigs active object-oriented database system - an overview,"g kappel, w retschitzegger",1998,the trigs active object-oriented database system-an overview.,acms anthology,1998,0
4247,4247,conf/vldb/LabrinidisR03,rKbwxobcJZYJ,balancing performance and data freshness in web database servers,"a labrinidis, n roussopoulos",2003,exploring the tradeoff between performance and data freshness in database-driven web servers,"a labrinidis, n roussopoulos",2004,0
6012,6012,journals/sigmod/Chaudhri98,url:http://portal.acm.org/ft_gateway.cfm%3Fid%3D273247%26type%3Dpdf%26dl%3DGUIDE%26dl%3DACM%26CFID%3D11111111%26CFTOKEN%3D2222222,workshop report on experiences using object data management in the real-world,,1998,workshop report on experiences using object data management in the real-world,ab chaudhri,1998,1
7893,7893,journals/sigmod/SnodgrassGIMSU98,CGvD6Du5kaoJ,reminiscences on influential papers,,1998,reminiscences on influential papers,r snodgrass,1976,0
1396,1396,conf/sigmod/Hellerstein94,pHHvswIOFfAJ,practical predicate placement,j hellerstein,1994,toward network data independence,j hellerstein,2003,0
4608,4608,conf/vldb/MorimotoFMTY98,yd2dxAbjvTAJ,algorithms for mining association rules for binary segmentations of huge categorical databases,"y morimoto, t fukuda, h matsuzawa, t tokuyama, k yoda",1998,sampling large databases for mining association rules. in: proceedings of the 22nd vldb conference,h toivonen,1996,0
