,_id,ltable_id,rtable_id,ltable_title,ltable_authors,ltable_year,rtable_title,rtable_authors,rtable_year,label
8447,8447,journals/tods/Chomicki95,zc9i-P-OfU4J,efficient checking of temporal integrity constraints using bounded history encoding,j chomicki,1995,temporal inegrity constraints in relational databases,j chomicki,0,0
8452,8452,journals/tods/CiacciaP02,LZAE3r3rxbsJ,searching in metric spaces with user-defined and approximate distances,"p ciaccia, m patella",2002,zezula pm-tree: an efficient access method for similarity search in metric spaces [c],"p ciaccia, m patella",0,0
9493,9493,journals/vldb/SheikholeslamiCZ00,D--FfiSLlMwJ,wavecluster: a wavelet based clustering approach for spatial data in very large databases,"g sheikholeslami, s chatterjee, a zhang",2000,mironlivny. birch: an efficient data clustering method for very large databases,rr tianzhang,0,0
1424,1424,conf/sigmod/HinneburgK99,C9imFvgrSvAJ,clustering methods for large databases: from the past to the future,"a hinneburg, d keim",1999,clustering methods for large databases: from the past to the future,"a hinneburg, da keim",1999,1
1366,1366,conf/sigmod/HanKS97,yzL3Kfsz8scJ,geominer: a system prototype for spatial data mining,"j han, k koperski, n stefanovic",1997,n. stefanovic 1997 â??geominer: a system prototype for spatial data miningâ??,"j han, k koperski",0,1
358,358,conf/sigmod/BarbosaMKL02,ueKnwQCE3nIJ,toxgene: a template-based data generator for xml,"d barbosa, a mendelzon, j keenleyside, k lyons",2002,toxgene: an extensible template-based data generator for xml.,"d barbosa, ao mendelzon, j keenleyside, ka lyons",0,1
5436,5436,conf/vldb/WangZ00,WtD34B68XEUJ,using sql to build new aggregates and extenders for object- relational systems,"h wang, c zaniolo",2000,using sql to build new aggregates and extenders for object-relational systems,hwc zaniolo,0,1
7624,7624,journals/sigmod/RossIJP00,url:http://portal.acm.org/ft_gateway.cfm%3Fid%3D390004%26type%3Dpdf%26dl%3DGUIDE%26dl%3DACM%26CFID%3D11111111%26CFTOKEN%3D2222222,reminiscences on influential papers,,2000,reminiscences on influential papers,e bertino,1976,0
5496,5496,conf/vldb/YagoubFIV00,195Hlqu94qEJ,caching strategies for data-intensive web sites,"k yagoub, d florescu, v issarny, p valduriez",2000,caching strategies for data-intensive web sites,"k yagoub, d florescu, v issarny, p valduriez",2000,1
9133,9133,journals/vldb/FengYLH02,Uxh3R2hfBOAJ,a template model for multidimensional inter-transactional association rules,"l feng, j yu, h lu, j han",2002,a template model for multidimensional inter-transactional association rules,"l feng, jx yu, h lu, j han",2002,1
2470,2470,conf/sigmod/Stonebraker03,0HMk-YUh4i8J,visionary: a next generation visualization system for databases,m stonebraker,2003,too much middleware,m stonebraker,2002,0
3862,3862,conf/vldb/Graefe99,abTf57w_9OAJ,the value of merge-join and hash-join in sql server,g graefe,1999,encapsulation of parallelism in the volcano query processing systems,g graefe,0,0
2790,2790,conf/sigmod/ZhugeGHW95,ylzKvQxmX7cJ,view maintenance in a warehousing environment,"y zhuge, h garcia-molina, j hammer, j widom",1995,"information translation, mediation, and mosaic-based browsing in the tsimmis system","j hammer, h garcia-molina, k ireland, y  ",1995,0
5615,5615,journals/sigmod/Aberer02,_hb7jvkdltcJ,book review column,k aberer,2002,special topic section on peer to peer data management,k aberer,0,0
4847,4847,conf/vldb/RothS97,9xWSlRBwaPIJ,"don't scrap it, wrap it! a wrapper architecture for legacy data sources","m roth, p schwarz",1997,"donâ??t scrap it, wrap it! a wrapper architecture for legacy data","m roth, p schwarz",1997,1
140,140,conf/sigmod/AcharyaGPR99a,s064OghlyIUJ,join synopses for approximate query answering,"s acharya, p gibbons, v poosala, s ramaswamy",1999,the aqua approximate query answering system,"s acharya, pb gibbons, v poosala, s ramaswamy",1999,0
3989,3989,conf/vldb/HinneburgAK00,1ambq2RMGMoJ,what is the nearest neighbor in high dimensional spaces?,"a hinneburg, c aggarwal, d keim",2000,what is the nearest neighbor in high dimensional spaces?,"a hinneburg, cc aggarwal, da keim",2000,1
4905,4905,conf/vldb/SakuraiYUK00,vI9c-zUADl8J,the a-tree: an index structure for high-dimensional spaces using relative approximation,"y sakurai, m yoshikawa, s uemura, h kojima",2000,the hybrid tree: an index structure for high dimensional feature spaces,"k chakrabarti, s mehrotra",0,0
2905,2905,conf/vldb/AgrawalS94,P0age7qyZacJ,fast algorithms for mining association rules in large databases,"r agrawal, r srikant",1994,fast algorithms for mining association rules in large databases,"r agrawal, r srikant",1994,1
5758,5758,journals/sigmod/Abiteboul99,lV0HWh9QLUQJ,on views and xml,s abiteboul,1999,data on the web: from relations to semistructured data and xml,s abiteboul,1999,0
7457,7457,journals/sigmod/Qian95,url:http://portal.acm.org/ft_gateway.cfm%3Fid%3D234903%26type%3Dpdf%26dl%3DGUIDE%26dl%3DACM%26CFID%3D11111111%26CFTOKEN%3D2222222,political winds change direction again,x qian,1995,scientists called upon to take actions,x qian,1996,0
536,536,conf/sigmod/BrownCL96,H4A7nUWyXtQJ,goal-oriented buffer management revisited,"k brown, m carey, m livny",1996,goal-oriented buffer management revisited,"kp brown, mj carey, m livny",1996,1
692,692,conf/sigmod/ChaudhuriG96,l-Sn0enuHxkJ,optimizing queries over multimedia repositories,"s chaudhuri, l gravano",1996,evaluating top-k selection queries,"s chaudhuri, l gravano",1999,0
6352,6352,journals/sigmod/FowlerPNB99,IgAEpc8ulvYJ,agent-based semantic interoperability in infosleuth,"j fowler, b perry, m nodine, b bargmeyer",1999,agent-based semantic interoperability in infosleuth,"b bargmeyer, j fowler, m nodine, b perry",0,1
1782,1782,conf/sigmod/LivnyRBCDLMW97,1rcDwhVp-o8J,devise: integrated querying and visualization of large datasets,"m livny, r ramakrishnan, k beyer, g chen, d donjerkovic, s lawande, j myllymaki, r wenger",1997,devise (demo abstract): integrated querying and visual exploration of large datasets,"m livny, r ramakrishnan, k beyer, g chen, d  ",1997,0
6951,6951,journals/sigmod/Konig-RiesMMPPRSVW02,FIxl60DSBqgJ,report on the nsf workshop on building an infrastructure for mobile and wireless systems,,2002,"p. veijalainen, j. and volfson, o. reports: on building an infrastructure for mobile and wireless  ","b konig-ries, k makki, s makki, c perkins, n  ",0,1
1625,1625,conf/sigmod/KornackerMH97,O81USJg2EhwJ,concurrency and recovery in generalized search trees,"m kornacker, c mohan, j hellerstein",1997,concurrency and recovery in generalized search trees,m kornacker,1997,1
4969,4969,conf/vldb/SavasereON95,CG-_La4oAYkJ,an efficient algorithm for mining association rules in large databases,"a savasere, e omiecinski, s navathe",1995,an efficient algorithm for mining association rules in large databases,s ashok,0,1
4588,4588,conf/vldb/Mohan99,p0wBdI_JiXMJ,repeating history beyond aries,c mohan,1999,in: technology for web services,c mohan,0,0
1856,1856,conf/sigmod/McAuliffeCS96,c__Nxyn_uvwJ,towards effective and efficient free space management,"m mcauliffe, m carey, m solomon",1996,towards effective and efficient free space management,"ml mcaulie, mj carey, mh solomon",0,1
3471,3471,conf/vldb/ChoG00,0ofvccnIJ-0J,the evolution of the web and implications for an incremental crawler,"j cho, h garcia-molina",2000,the evolution of the web and implications for an incremental crawler. 26th intl,"j cho, h garcia-molina",0,1
9489,9489,journals/vldb/SheikholeslamiCZ00,2GWXn3jT0uwJ,wavecluster: a wavelet based clustering approach for spatial data in very large databases,"g sheikholeslami, s chatterjee, a zhang",2000,wavecluster: a wavelet based clustering approach for spatial data,g sheikholeslamiâ?¦,0,1
4363,4363,conf/vldb/LuL00,Ih5hY-NRmFgJ,decision tables: scalable classification exploring rdbms capabilities,"h lu, h liu",2000,decision tables: scalable classification exploring rdbms capabilities,"h lu, h liu",2000,1
3415,3415,conf/vldb/ChaudhuriS01,w5_HkketH-wJ,storage and retrieval of xml data using relational databases,,2001,the xxl search engine: ranked retrieval of xml data using indexes and ontologies,"a theobald, g weikum",2002,0
16,16,conf/sigmod/2000,url:http://portal.acm.org/citation.cfm%3Fid%3D191839,"proceedings of the 2000 acm sigmod international conference on management of data, may 16-18, 2000, dallas, texas, usa",,2000,source international conference on management of data archive,"rt snodgrass, m winslett",1994,0
4537,4537,conf/vldb/Mohan02a,IWM2gExnQLkJ,an efficient method for performing record deletions and updates using index scans,c mohan,2002,tutorial: a survey and critique of advanced transaction models,c mohan,0,0
6450,6450,journals/sigmod/Franklin97a,url:http://www.roc.noaa.gov/news/vol1is4.pdf,editor's notes,m franklin,1997,editor's notes,nl smith,1981,0
2394,2394,conf/sigmod/ShenNSHS03,LjrsWIr3rhAJ,cmvf: a novel dimension reduction scheme for efficient indexing in a large image database,"j shen, a ngu, j shepherd, d huynh, q sheng",2003,cmvf: a novel dimension reduction scheme for efficient indexing in a large image database,"j shen, ahh ngu, j shepherd, dq huynh, qz sheng",2003,1
6232,6232,journals/sigmod/EisenbergM02,6uelfg3RgEoJ,sql/xml is making good progress,"a eisenberg, j melton",2002,an early look at xquery,"a eisenberg, j melton",2002,0
755,755,conf/sigmod/ChenRW02,05ShsIGjnKkJ,xcache: a semantic caching system for xml queries,"l chen, e rundensteiner, s wang",2002,xcache: a semantic caching system for xml queries,"l chen, ea rundensteiner, s wang",2002,1
9184,9184,journals/vldb/Halevy02,CYJR7X2NtGMJ,guest editorial,,2002,guest editorial,h simon,1995,0
670,670,conf/sigmod/ChangH02,4zxRX5K-YSsJ,minimal probing: supporting expensive predicates for top-k queries,"k chang, s hwang",2002,minimal probing: supporting expensive predicates for top-k queries,"kcc chang, s hwang",2002,1
7294,7294,journals/sigmod/MeltonE01,tE1YtM19O5EJ,sql multimedia and application packages (sql/mm),"j melton, a eisenberg",2001,standard sql/mm: sql multimedia and application packages,"k jankiewicz, m wojciechowski",0,0
6166,6166,journals/sigmod/Dogac96,gt_wY6mYF_kJ,middle east technical university software research and development center,a dogac,1996,"metu object-oriented database system, demo description",a dogac,0,0
4407,4407,conf/vldb/MargaritisFT01,QdyhPQjP2WIJ,netcube: a scalable tool for fast data mining and compression,"d margaritis, c faloutsos, s thrun",2001,seiq: a fast and scalable classifier for data mining [r],"m mehta, r agrawal, j rissanen",0,0
8734,8734,journals/tods/Snodgrass01,url:http://www.springerlink.com/index/N2VQ4NK4H736R74T.pdf,editorial,,2001,editorial,"p muschamp, j hill",2004,0
348,348,conf/sigmod/Ballinger94,xGGBIZmLvmgJ,evolving teradata decision support for massively parallel processing with unix,c ballinger,1994,evolving teradata decision support for massively parallel processing with unix,c ballinger,1994,1
8945,8945,journals/vldb/AtluriJY03,url:http://portal.acm.org/ft_gateway.cfm%3Fid%3D765219%26type%3Dpdf%26dl%3DGUIDE%26dl%3DACM%26CFID%3D11111111%26CFTOKEN%3D2222222,guest editorial,,2003,guest editorial,"jr gruser, l raschid, v zadorozhny",2000,0
6775,6775,journals/sigmod/HasselbringHHKRRS00,ojKdNggRzbkJ,"research and practice in federated information systems, report of the efis '2000 international workshop",,2000,awareness and practice of information systems development methodologies in business today,"b saunders, e georgiadou",0,0
4064,4064,conf/vldb/IwerksSS03,TcSLnozhpgkJ,continuous k-nearest neighbor queries for continuously moving points with updates,"g iwerks, h samet, k smith",2003,maintenance of spatial semijoin queries on moving points,"g iwerks, h samet, k smith",2004,0
1266,1266,conf/sigmod/Grust02,CKiAavnrRH4J,accelerating xpath location steps,t grust,2002,staircase join: teach a rdbms to watch its,t grust,0,0
7778,7778,journals/sigmod/SmithO99,uPx8w3k7NyQJ,unpacking the semantics of source and usage to perform semantic reconciliation in large-scale information systems,"k smith, l obrst",1999,infosleuth: agent-based semantic integration of information in open and dynamic systems,"rj bayardo, w bohrer, a cichocki, jj fowler, a  ",0,0
5605,5605,journals/sigmod/Aberer01a,url:http://portal.acm.org/ft_gateway.cfm%3Fid%3D601865%26type%3Dpdf%26coll%3DGUIDE%26dl%3DACM%26CFID%3D11111111%26CFTOKEN%3D2222222,book review column,k aberer,2001,book review column,l processing,2002,0
6908,6908,journals/sigmod/Kim94,Tlv-A9lX8owJ,observations on the odmg-93 proposal,w kim,1994,"alli., e.: composite objects revisited",w kim,0,0
4491,4491,conf/vldb/Mohan01,14cgU3tAHtgJ,caching technologies for web applications,c mohan,2001,state of the art in workflow management system research and products. tutorial notes,c mohan,0,0
3285,3285,conf/vldb/CareyD96,5HV8kccLoZ4J,of objects and databases: a decade of turmoil,"m carey, d dewitt",1996,of objects and databases: a decade of turmoil. 22nd vldb conf,"mj carey, dj dewitt",0,1
3913,3913,conf/vldb/GyssensL97,7jSBx3h3cvUJ,a foundation for multi-dimensional databases,"m gyssens, l lakshmanan",1997,a foundation for multi-dimensional databases,"m gyssens, lvs lakshmanan",0,1
6630,6630,journals/sigmod/GatziuJSV99,url:http://portal.acm.org/ft_gateway.cfm%3Fid%3D1083799%26type%3Dpdf,design and management of data warehouses: report on the dmdw'99 workshop,"s gatziu, m jeusfeld, m staudt, y vassiliou",1999,report on the international workshop on pattern representation and management (parmaâ??04),"y theodoridis, p vassiliadis",2005,0
5185,5185,conf/vldb/Shmueli01,bjtnGkW6L3kJ,architectures for internal web services deployment,o shmueli,2001,alon itai. maintenance of views,o shmueli,0,0
457,457,conf/sigmod/BohrerBBCFHKKMNRRSUUW97,fdruJtO0F0UJ,infosleuth: semantic integration of information in open and dynamic environments (experience paper),"r jr., w bohrer, r brice, a cichocki, j fowler, a helal, v kashyap, t ksiezyk, g martin, m nodine, m rashid, m rusinkiewicz, r shea, c unnikrishnan, a unruh, d woelk",1997,"m., and widoff s.: dynamic service matchmaking among agents in open information environments","k sycara, k lu",0,0
1442,1442,conf/sigmod/HristidisKP01,dpu0E5Tb0foJ,prefer: a system for the efficient execution of multi-parametric ranked queries,"v hristidis, n koudas, y papakonstantinou",2001,keyword proximity search in xml trees,"v hristidis, n koudas, y papakonstantinou",0,0
7113,7113,journals/sigmod/Liu02,url:http://doi.wiley.com/10.1002/ev.1658,editor's notes,l liu,2002,editor's notes,l sechrest,1993,0
8063,8063,journals/sigmod/Widom95,lAbG3uFZvVUJ,editor's notes,j widom,1995,research issues in active database systems: report from the closing panel at ride-ads '94,j widom,1994,0
8146,8146,journals/sigmod/Widom96a,url:http://portal.acm.org/citation.cfm%3Fid%3D219713%26dl%3DGUIDE%26dl%3DACM%26type%3Dissue%26idx%3DJ689%26part%3Dperiodical%26WantType%3Dperiodical%26title%3DACM%2520SIGMOD%2520Record%26CFID%3D11111111%26CFTOKEN%3D2222222,editor's notes,j widom,1996,source acm sigmod record archive,j widom,1995,0
4852,4852,conf/vldb/RothS97,Xdi3nTAu4YQJ,"don't scrap it, wrap it! a wrapper architecture for legacy data sources","m roth, p schwarz",1997,a wrapper architecture for legacy data sources,wi donâ??t scrap it,1997,0
4108,4108,conf/vldb/JonscherD94,iBEI8pUanCEJ,an approach for building secure database federations,"d jonscher, k dittrich",1994,an approach for building secure database federations [a],"j dirk, rd klaus",0,1
1512,1512,conf/sigmod/JonssonFS98,5fb1l1MyGisJ,interaction of query evaluation and buffer management for information retrieval,"b jï¿½nsson, m franklin, d srivastava",1998,interaction of query evaluation and buffer management for information retrieval,"bt jonsson, mj franklin, d srivastava",1998,1
9046,9046,journals/vldb/CandanLS00,v1MIy7nisZMJ,view management in multimedia databases,"k candan, e lemar, v subrahmanian",2000,view management in multimedia databases,"sc kasim, e lemar, vs subrahmanian",0,1
3110,3110,conf/vldb/BaumgartnerFG01,SuA6ug99YisJ,visual web information extraction with lixto,"r baumgartner, s flesca, g gottlob",2001,gg: visual web information extraction with lixto,"r baumgartner, s flesca",0,1
3398,3398,conf/vldb/ChaudhuriGS95,ThEw8obz2UsJ,retrieval of composite multimedia objects,"s chaudhuri, s ghandeharizadeh, c shahabi",1995,avoiding retrival contention for composite multimedia objects,"s chaudhuri, s ghandeharizadeh, c shahabi",0,0
8066,8066,journals/sigmod/Widom95,rVFh4WHFxoUJ,editor's notes,j widom,1995,"a denotational semantics for the starburst production rule language, 1992",j widom,0,0
7115,7115,journals/sigmod/Liu02,url:http://www.roc.noaa.gov/news/vol1is4.pdf,editor's notes,l liu,2002,editor's notes,nl smith,1981,0
355,355,conf/sigmod/BarbaraI94,bTYTn8VG5hIJ,sleepers and workaholics: caching strategies in mobile environments,"d barbarï¿½, t imielinski",1994,"ã¢â?¬ å?sleepers and workaholics: caching strategies for mobile environments, ã¢â?¬â?","d barbara, t imielinski",0,1
8032,8032,journals/sigmod/WeikumSR03,url:http://portal.acm.org/ft_gateway.cfm%3Fid%3D1058166%26type%3Dpdf,"report on the 10th conference on database systems for business, technology, and the web (btw 2003)",,2003,report on mobide 2003: the 3rd international acm workshop on data engineering for wireless and  ,"s banerjee, m cherniack, v kumar, pk chrysanthis,  ",2005,0
8261,8261,journals/sigmod/Winslett94,8lafnpE84ocJ,progress on hpcc and nii,m winslett,1994,distinguished database profiles: interview with jim gray,m winslett,0,0
1417,1417,conf/sigmod/HernandezS95,KJyo5lhO_vAJ,the merge/purge problem for large databases,"m hernï¿½ndez, s stolfo",1995,the merge/purge problem for large databases,s stolfo,1995,1
2102,2102,conf/sigmod/OlstonJW03,url:http://portal.acm.org/ft_gateway.cfm%3Fid%3D974756%26type%3Dpdf%26dl%3DACM%26dl%3DACM%26CFID%3D11111111%26CFTOKEN%3D2222222,adaptive filters for continuous queries over distributed data streams,"c olston, j jiang, j widom",2003,characterizing memory requirements for queries over continuous data streams,j widom,2004,0
5940,5940,journals/sigmod/BunemanLSTW94,lkreWUl_euYJ,comprehension syntax,"p buneman, l libkin, d suciu, v tannen, l wong",1994,comprehension syntax,"p buneman, l libkin, d suciu, v tannen, l wong",1994,1
2019,2019,conf/sigmod/MumickP94,3eSwRxf3-3sJ,implementation of magic-sets in a relational database system,"i mumick, h pirahesh",1994,implementation of data abstraction in the relational database system ingres,j ong,1984,0
6914,6914,journals/sigmod/Kim94,url:http://portal.acm.org/citation.cfm%3Fid%3D357775%26dl%3DGUIDE%26dl%3DACM%26type%3Dissue%26idx%3DJ777%26part%3Dperiodical%26WantType%3Dperiodical%26title%3DACM%2520Transactions%2520on%2520Database%2520Systems%2520(TODS)%26CFID%3D11111111%26CFTOKEN%3D2222222,observations on the odmg-93 proposal,w kim,1994,source acm transactions on database systems (tods) archive,w kim,1993,0
9065,9065,journals/vldb/ChandrasekaranF03,b9r9U3OwrkcJ,psoup: a system for streaming queries over streaming data,"s chandrasekaran, m franklin",2003,psoup: a system for streaming queries over streaming data,"s chandrasekaran, mj franklin",2003,1
6517,6517,journals/sigmod/Franklin98b,iDBvvrHwj7YJ,editor's notes,m franklin,1998,"b. j onsson, and d. kossmann. performance tradeoffs for client-server query processing",m franklin,0,0
1466,1466,conf/sigmod/ImielinskiVB94,cffLplmoKH4J,energy efficient indexing on air,"t imielinski, s viswanathan, b badrinath",1994,energy efficient indexing on air,"t imielinski, s viswanathan, br badrinath",0,1
9555,9555,journals/vldb/YangW03,IJDg4R1pw6EJ,incremental computation and maintenance of temporal aggregates,"j yang, j widom",2003,"incremental computation and maintenance of temporal aggregates&quot;(full version), techreport","j yang, j widom",2000,1
9372,9372,journals/vldb/Navarro02,yzXbpCrvSq4J,searching in metric spaces by spatial approximation,g navarro,2002,approximate string matching by counting,g navarro,0,0
4635,4635,conf/vldb/NatsevCSLV01,lD7OgF3Xw6wJ,supporting incremental join queries on ranked inputs,"a natsev, y chang, j smith, c li, j vitter",2001,"and vitter, j. supporting incremental join queries on ranked inputs","a natsev, yc chang, j smith, cs li",2001,1
98,98,conf/sigmod/AbiteboulCM95,-cQmLk2JnawJ,a database interface for file updates,"s abiteboul, s cluet, t milo",1995,querying the le,"s abiteboul, s cluet, t milo",0,0
925,925,conf/sigmod/DoanDH01,ShOPf844dK4J,reconciling schemas of disparate data sources: a machine-learning approach,"a doan, p domingos, a halevy",2001,learning to match the schemas of data sources: a multistrategy approach,"ah doan, p domingos, a halevy",2003,0
590,590,conf/sigmod/Carey00,url:http://portal.acm.org/citation.cfm%3Fid%3D335476%26dl%3DACM%26coll%3Dportal%26CFID%3D11111111%26CFTOKEN%3D2222222,on xml and databases: where's the beef? (panel abstract),m carey,2000,of xml and databases (panel session): where's the beef?,"j widom, a bosworth, b lindsay, m stonebraker, d  ",2000,0
4542,4542,conf/vldb/Mohan02a,YJlUtEk7zwkJ,an efficient method for performing record deletions and updates using index scans,c mohan,2002,application servers and associated technologies,c mohan,0,0
3817,3817,conf/vldb/GoldmanSVG98,4qYPBQ1l07YJ,proximity search in databases,"r goldman, n shivakumar, s venkatasubramanian, h garcia-molina",1998,proximity search in databases,"g roy, s narayanan, v suresh, g hector",0,1
4042,4042,conf/vldb/IlyasAE03,Y385z1Dxp84J,supporting top-k join queries in relational databases,"i ilyas, w aref, a elmagarmid",2003,supporting top-k join queries in relational databases,"if ilyas, wg aref, ak elmagarmid",2004,1
2424,2424,conf/sigmod/ShuklaD00,kcrWfQEI9G8J,tutorial: ldap directory services - just another database application?,,2000,tutorial: ldap directory services - just another database application?,"s shukla, a deshpande",2000,1
7867,7867,journals/sigmod/Snodgrass94,VwZQmafqkE0J,overview of the special section on temporal database infrastructure,r snodgrass,1994,the temporal query language tquel,r snodgrass,1987,0
8355,8355,journals/tods/BaralisW00,Z0lLE6fJWsMJ,an algebraic approach to static analysis of active database rules,"e baralis, j widom",2000,better static rule analysis for active database systems,"e baralis, j widom",0,0
2857,2857,conf/vldb/AgrawalCN00,U8CMJBaJyX8J,automated selection of materialized views and indexes in sql databases,"s agrawal, s chaudhuri, v narasayya",2000,automated selection of materialized views and indexes in sql databases,"s agrawal, s chaudhuri, vr narasayya",2000,1
7667,7667,journals/sigmod/Segev94,url:http://doi.wiley.com/10.1002/ev.1658,editor's notes,a segev,1994,editor's notes,l sechrest,1993,0
8911,8911,journals/vldb/Atkinson00,CYJR7X2NtGMJ,guest editorial,,2000,guest editorial,h simon,1995,0
8791,8791,journals/tods/TariSS97,8UdB5vOY_r0J,object normal forms and dependency constraints for object-oriented schemata,"z tari, j stokes, s spaccapietra",1997,"object normal forms and dependency constraints for object-oriented schemata, acm tans","z tari, j stokes, s spaccapietra",0,1
4902,4902,conf/vldb/SakuraiYUK00,kCH4ZzrozMkJ,the a-tree: an index structure for high-dimensional spaces using relative approximation,"y sakurai, m yoshikawa, s uemura, h kojima",2000,the x-tree: an index structure for high-dimensional data [a],"b stefan, da keim, hp kriegel",1996,0
164,164,conf/sigmod/Adelberg98,lyTJMJmpo8IJ,nodose - a tool for semi-automatically extracting semi-structured data from text documents,b adelberg,1998,tool for semi-automatically extracting structured and semistructured data from text documents,"b adelberg, a nodose",0,1
8580,8580,journals/tods/Kim94,Cnzg5SgaiyMJ,charter and scope,w kim,1994,on optimization a sql-like nested query,w kim,0,0
3614,3614,conf/vldb/DillKMRST01,eZoS-yciSRsJ,self-similarity in the web,"s dill, r kumar, k mccurley, s rajagopalan, d sivakumar, a tomkins",2001,self-similarity in the web,"s dill, r kumar, ks mccurley, s rajagopalan, d  ",2002,1
3936,3936,conf/vldb/HalversonBKKRTVWND03,VYYKHi96iQkJ,mixed mode xml query processing,"a halverson, j burger, l galanis, a kini, r krishnamurthy, a rao, f tian, s viglas, y wang, j naughton, d dewitt",2003,efficient algorithms for processing xpath queries,"a halverson, j burger, l galanis, a kini, r  ",2003,0
2633,2633,conf/sigmod/WangPFY03,2W9Mp_ZnqRoJ,vist: a dynamic index method for querying xml data by tree structures,"h wang, s park, w fan, p yu",2003,mining concept-drifting data streams using ensemble classifiers,"h wang, w fan, ps yu, j han",2003,0
608,608,conf/sigmod/CareyMN97,u64n4yMnma4J,"object-relational database systems: principles, products, and challenges (tutorial)",,1997,"object-relational database systems: principles, products, and challenges (tutorial)","mj carey, nm mattos, a nori",0,1
453,453,conf/sigmod/BohrerBBCFHKKMNRRSUUW97,Htez7173OBUJ,infosleuth: semantic integration of information in open and dynamic environments (experience paper),"r jr., w bohrer, r brice, a cichocki, j fowler, a helal, v kashyap, t ksiezyk, g martin, m nodine, m rashid, m rusinkiewicz, r shea, c unnikrishnan, a unruh, d woelk",1997,infosleuth (1997) agent-based semantic integration of information in open and dynamic environments,r bayardoâ?¦,0,0
1545,1545,conf/sigmod/KatayamaS97,G-XP436aGVAJ,the sr-tree: an index structure for high-dimensional nearest neighbor queries,"n katayama, s satoh",1997,the sr-tree: an index structure forhigh-dimensionalnearest neighbor queries,"n katayama, s satoh",0,1
4737,4737,conf/vldb/PedersenJD99,a36_v9H699oJ,extending practical pre-aggregation in on-line analytical processing,"t pedersen, c jensen, c dyreson",1999,dce extending practical pre-aggregation in on-line analytical processing,"tb pedersen, cs jensen",0,1
